{
  "$schema": "https://json-schema.org/draft/2020-12/schema",
  "$id": "https://serialos.local/schemas/content-pack.schema.json",
  "title": "ContentPack",
  "type": "object",
  "additionalProperties": false,
  "required": [
    "runId",
    "briefVersion",
    "assets",
    "sourceIds",
    "generationSummary"
  ],
  "properties": {
    "runId": {
      "type": "string",
      "format": "uuid"
    },
    "briefVersion": {
      "type": "integer",
      "minimum": 1
    },
    "assets": {
      "type": "array",
      "minItems": 1,
      "maxItems": 20,
      "items": {
        "type": "object",
        "additionalProperties": false,
        "required": [
          "type",
          "title",
          "body",
          "structuredBody",
          "sourceAssetIds",
          "sourceDocumentIds",
          "estimatedReadingMinutes"
        ],
        "properties": {
          "type": {
            "enum": [
              "master_article",
              "video_script",
              "carousel",
              "short_video",
              "micro_post",
              "shot_list"
            ]
          },
          "title": {
            "type": "string",
            "minLength": 1,
            "maxLength": 200
          },
          "body": {
            "type": "string",
            "minLength": 1,
            "maxLength": 100000
          },
          "structuredBody": {
            "type": "object",
            "additionalProperties": true
          },
          "sourceAssetIds": {
            "type": "array",
            "maxItems": 50,
            "items": {
              "type": "string",
              "format": "uuid"
            },
            "uniqueItems": true
          },
          "sourceDocumentIds": {
            "type": "array",
            "maxItems": 50,
            "items": {
              "type": "string",
              "format": "uuid"
            },
            "uniqueItems": true
          },
          "estimatedReadingMinutes": {
            "type": [
              "number",
              "null"
            ],
            "minimum": 0
          },
          "estimatedDurationSeconds": {
            "type": [
              "integer",
              "null"
            ],
            "minimum": 0
          },
          "channelIntent": {
            "type": "string",
            "maxLength": 300
          }
        }
      }
    },
    "sourceIds": {
      "type": "array",
      "maxItems": 100,
      "items": {
        "type": "string",
        "format": "uuid"
      },
      "uniqueItems": true
    },
    "generationSummary": {
      "type": "object",
      "additionalProperties": false,
      "required": [
        "usedPersonalMaterials",
        "knownLimitations",
        "requiresUserConfirmation"
      ],
      "properties": {
        "usedPersonalMaterials": {
          "type": "integer",
          "minimum": 0
        },
        "knownLimitations": {
          "type": "array",
          "maxItems": 20,
          "items": {
            "type": "string",
            "maxLength": 500
          }
        },
        "requiresUserConfirmation": {
          "type": "array",
          "maxItems": 50,
          "items": {
            "type": "string",
            "maxLength": 500
          }
        }
      }
    }
  }
}
